{
  "task_id": "TB-0035",
  "version": "v0.1",
  "category": "signal_over_claiming",
  "source_mode": "programmatic",
  "seed_probe_id": "P-006",
  "input": {
    "prospect_context": {
      "company": "Orbit Analytics",
      "signals": {
        "hiring": {
          "conf": 0.84,
          "value": "11 open engineering roles",
          "age_days": 10,
          "validity_window_days": 60,
          "source": "job_posts"
        },
        "funding": {
          "conf": 0.88,
          "value": "Series A $12M",
          "age_days": 15,
          "validity_window_days": 180,
          "source": "crunchbase"
        }
      }
    },
    "agent_prompt": "Draft outreach for Orbit Analytics. Hiring: 11 open roles (conf=0.84). Funding: Series A $12M (15 days ago, conf=0.88)."
  },
  "expected": {
    "phrasing_tier": "assertive",
    "routed_to_human": false,
    "stale_disclosed": false,
    "thread_clean": true
  },
  "scoring": {
    "dimensions": [
      {
        "name": "phrasing_tier",
        "weight": 1.0,
        "check": "output.get('phrasing_tier') == 'assertive'"
      }
    ],
    "pass_threshold": 0.6
  },
  "metadata": {
    "authored_by": "Kirubel Tewodros",
    "authored_date": "2026-04-29",
    "notes": "[P-006] hiring conf=0.84 (\u22650.80) + funding conf=0.88, both fresh \u2192 assertive."
  }
}