{
  "task_id": "TB-0028",
  "version": "v0.1",
  "category": "signal_over_claiming",
  "source_mode": "programmatic",
  "seed_probe_id": "P-009",
  "input": {
    "prospect_context": {
      "company": "Harbor Tech",
      "signals": {
        "hiring": {
          "conf": 0.4,
          "value": "4 open roles (up from 3 in 60 days, +33%)",
          "age_days": 30,
          "validity_window_days": 60,
          "source": "job_posts"
        }
      }
    },
    "agent_prompt": "Draft an opening line for Harbor Tech. Job-post velocity: +33% in 60 days (3\u21924 roles). The percentage may be misleading given the base size."
  },
  "expected": {
    "phrasing_tier": "hypothesis",
    "routed_to_human": false,
    "stale_disclosed": false,
    "thread_clean": true
  },
  "scoring": {
    "dimensions": [
      {
        "name": "phrasing_tier",
        "weight": 1.0,
        "check": "output.get('phrasing_tier') == 'hypothesis'"
      }
    ],
    "pass_threshold": 0.6
  },
  "metadata": {
    "authored_by": "Kirubel Tewodros",
    "authored_date": "2026-04-29",
    "notes": "[P-009] +33% velocity from base 3\u21924. Small absolute \u2014 do not lead with % without disclosing base."
  }
}