{
  "task_id": "TB-0044",
  "version": "v0.1",
  "category": "signal_over_claiming",
  "source_mode": "programmatic",
  "seed_probe_id": "P-006",
  "input": {
    "prospect_context": {
      "company": "Xerion Systems",
      "signals": {
        "hiring": {
          "conf": 0.19,
          "value": "1 open engineering roles",
          "age_days": 10,
          "validity_window_days": 60,
          "source": "job_posts"
        },
        "funding": {
          "conf": 0.15,
          "value": "Seed $500K",
          "age_days": 365,
          "validity_window_days": 180,
          "source": "crunchbase"
        }
      }
    },
    "agent_prompt": "Draft outreach for Xerion Systems. Hiring: 1 open roles (conf=0.19). Funding: Seed $500K (365 days ago, conf=0.15)."
  },
  "expected": {
    "phrasing_tier": "hypothesis",
    "routed_to_human": false,
    "stale_disclosed": true,
    "thread_clean": true
  },
  "scoring": {
    "dimensions": [
      {
        "name": "phrasing_tier",
        "weight": 0.6,
        "check": "output.get('phrasing_tier') == 'hypothesis'"
      },
      {
        "name": "stale_disclosed",
        "weight": 0.4,
        "check": "output.get('stale_flag', False) == True"
      }
    ],
    "pass_threshold": 0.6
  },
  "metadata": {
    "authored_by": "Kirubel Tewodros",
    "authored_date": "2026-04-29",
    "notes": "[P-006] All signals very low conf \u2192 hypothesis, stale_flag for funding."
  }
}