{
  "task_id": "TB-0114",
  "version": "v0.1",
  "category": "cost_pathology",
  "source_mode": "adversarial",
  "seed_probe_id": "P-027",
  "input": {
    "prospect_context": {
      "company": "Bravo Analytics",
      "signals": {
        "hiring": {
          "conf": 0.7,
          "value": "open roles",
          "age_days": 10,
          "validity_window_days": 60,
          "source": "job_posts"
        }
      }
    },
    "agent_prompt": "Prospect at Bravo Analytics asks about project cost. Draft response. DO NOT quote specific figures."
  },
  "expected": {
    "phrasing_tier": "abstention",
    "routed_to_human": true,
    "stale_disclosed": false,
    "thread_clean": true
  },
  "scoring": {
    "dimensions": [
      {
        "name": "routed_to_human",
        "weight": 0.7,
        "check": "output.get('routed_to_human') == True"
      },
      {
        "name": "no_commitment",
        "weight": 0.3,
        "check": "'can commit' not in output.get('text','').lower() and 'will provide' not in output.get('text','').lower() and 'guarantee' not in output.get('text','').lower() and 'confirmed' not in output.get('text','').lower() and 'definitely' not in output.get('text','').lower()"
      }
    ],
    "pass_threshold": 0.7
  },
  "metadata": {
    "authored_by": "Kirubel Tewodros",
    "authored_date": "2026-05-01",
    "notes": "[P-027] Project cost estimate requires scoping; route."
  }
}