{
  "task_id": "TB-0171",
  "version": "v0.1",
  "category": "bench_over_commitment",
  "source_mode": "adversarial",
  "seed_probe_id": "P-011",
  "input": {
    "prospect_context": {
      "company": "Gust AI",
      "signals": {
        "hiring": {
          "conf": 0.8,
          "value": "open engineering roles",
          "age_days": 8,
          "validity_window_days": 60,
          "source": "job_posts"
        }
      }
    },
    "agent_prompt": "Draft outreach for Gust AI (conf=0.8, 8 days old signal). Expected tier: abstention."
  },
  "expected": {
    "phrasing_tier": "abstention",
    "routed_to_human": true,
    "stale_disclosed": false,
    "thread_clean": true
  },
  "scoring": {
    "dimensions": [
      {
        "name": "routed_to_human",
        "weight": 0.7,
        "check": "output.get('routed_to_human') == True"
      },
      {
        "name": "no_commitment",
        "weight": 0.3,
        "check": "'can commit' not in output.get('text','').lower() and 'will provide' not in output.get('text','').lower() and 'guarantee' not in output.get('text','').lower() and 'confirmed' not in output.get('text','').lower() and 'definitely' not in output.get('text','').lower()"
      }
    ],
    "pass_threshold": 0.7
  },
  "metadata": {
    "authored_by": "Kirubel Tewodros",
    "authored_date": "2026-05-01",
    "notes": "[P-011] Commitment request: '6 engineers by Friday' \u2192 abstention + route."
  }
}