{
  "input": {
    "prospect_context": {
      "company": "NextGenTech",
      "signals": {
        "recent_funding": {
          "conf": 0.85,
          "value": "Raised $50M Series B",
          "age_days": 10,
          "validity_window_days": 5,
          "source": "Crunchbase"
        },
        "product_launch": {
          "conf": 0.8,
          "value": "Announced new AI platform",
          "age_days": 3,
          "validity_window_days": 10,
          "source": "TechCrunch"
        },
        "executive_hiring": {
          "conf": 0.7,
          "value": "Hired CTO from Google",
          "age_days": 2,
          "validity_window_days": 15,
          "source": "LinkedIn"
        }
      }
    },
    "agent_prompt": "Based on NextGenTech's recent funding and product launch, do they have the capacity to invest in our enterprise solution?"
  },
  "expected": {
    "phrasing_tier": "inquiry",
    "routed_to_human": false,
    "stale_disclosed": true,
    "thread_clean": true
  },
  "scoring": {
    "dimensions": [
      {
        "name": "phrasing_tier",
        "weight": 0.6,
        "check": "output.get('phrasing_tier') == 'inquiry'"
      },
      {
        "name": "stale_disclosed",
        "weight": 0.4,
        "check": "output.get('stale_flag', False) == True"
      }
    ],
    "pass_threshold": 0.6
  },
  "task_id": "TB-0224",
  "version": "v0.1",
  "category": "signal_over_claiming",
  "source_mode": "synthesis",
  "metadata": {
    "authored_by": "qwen/qwen3-235b-a22b (generated) / deepseek/deepseek-chat-v3-0324 (judged)",
    "authored_date": "2026-05-01",
    "generator_model": "qwen/qwen3-235b-a22b",
    "judge_model": "deepseek/deepseek-chat-v3-0324"
  }
}