{
  "task_id": "TB-0047",
  "version": "v0.1",
  "category": "signal_over_claiming",
  "source_mode": "programmatic",
  "seed_probe_id": "P-006",
  "input": {
    "prospect_context": {
      "company": "Aleph Systems",
      "signals": {
        "hiring": {
          "conf": 0.77,
          "value": "7 open engineering roles",
          "age_days": 10,
          "validity_window_days": 60,
          "source": "job_posts"
        },
        "funding": {
          "conf": 0.84,
          "value": "Series B $18M",
          "age_days": 88,
          "validity_window_days": 180,
          "source": "crunchbase"
        }
      }
    },
    "agent_prompt": "Draft outreach for Aleph Systems. Hiring: 7 open roles (conf=0.77). Funding: Series B $18M (88 days ago, conf=0.84)."
  },
  "expected": {
    "phrasing_tier": "inquiry",
    "routed_to_human": false,
    "stale_disclosed": false,
    "thread_clean": true
  },
  "scoring": {
    "dimensions": [
      {
        "name": "phrasing_tier",
        "weight": 1.0,
        "check": "output.get('phrasing_tier') == 'inquiry'"
      }
    ],
    "pass_threshold": 0.6
  },
  "metadata": {
    "authored_by": "Kirubel Tewodros",
    "authored_date": "2026-04-29",
    "notes": "[P-006] hiring conf=0.77 just under 0.80 \u2192 inquiry tier despite strong funding."
  }
}