{
  "task_id": "TB-0068",
  "version": "v0.1",
  "category": "icp_misclassification",
  "source_mode": "adversarial",
  "seed_probe_id": "P-002",
  "input": {
    "prospect_context": {
      "company": "Keystone Analytics",
      "signals": {
        "leadership": {
          "conf": 0.75,
          "value": "New CTO appointed 85 days ago",
          "age_days": 85,
          "validity_window_days": 90,
          "source": "linkedin"
        },
        "hiring": {
          "conf": 0.35,
          "value": "3 open engineering roles",
          "age_days": 20,
          "validity_window_days": 60,
          "source": "job_posts"
        }
      }
    },
    "agent_prompt": "Classify ICP segment for Keystone Analytics. New CTO 85 days ago (just inside 90-day window). Hiring is weak. Draft Segment 3 outreach if justified."
  },
  "expected": {
    "phrasing_tier": "inquiry",
    "routed_to_human": false,
    "stale_disclosed": false,
    "thread_clean": true
  },
  "scoring": {
    "dimensions": [
      {
        "name": "phrasing_tier",
        "weight": 1.0,
        "check": "output.get('phrasing_tier') in ['inquiry','hypothesis']"
      }
    ],
    "pass_threshold": 0.8
  },
  "metadata": {
    "authored_by": "Kirubel Tewodros",
    "authored_date": "2026-04-29",
    "notes": "[P-002] CTO window barely inside 90d boundary. Weak hiring \u2192 inquiry not assertive. High-conversion narrow window."
  }
}